adult,backdrop_path,genre_ids,id,original_language,original_title,overview,popularity,poster_path,release_date,title,video,vote_average,vote_count
False,/TB88CYene7rzMs32FzFTLs0eU4.jpg,"[10749, 35]",785539,en,Resort to Love,"실연에 울고, 막막한 가수 생활에 또 우는 여자. 호화 리조트에서 가수로 일하기 시작한 것까진 좋았는데. 아뿔싸, 이게 웬걸? 전 약혼자가 리조트에 왔다. 다른 여자와의 결혼식을 위해!",21.083,/7w4gX4zRlONqThjhmjdxw93FAXt.jpg,2021-07-29,사랑의 리조트,False,7.211,393
False,/6DqzZaTAzFrT53JtRt3MLKs0Y9i.jpg,"[18, 35]",10625,en,Mean Girls,동물학자인 아버지를 따라 아프리카에서 성장한 케이디 (린제이 로한 분)는 일리노이즈의 고등 학교로 전학을 오게 된다. 케이디가 전학 온 고등학교에는 레지나(레이첼 맥아담스 분) 라는 퀸카가 그녀의 매력을 주무기로 학교의 여왕으로 군림을 하고 있었다.  레지나는 케이디가 지닌 미모와 지성이 자신이 누리고 있는 교내 '여왕벌'의 위치를 위협할 수 있다고 판단하고 그녀를 감시할 목적으로 케이디에게 접근을 하여 둘은 친구가 된다. 케이디는 수학시간에 만난 남학생 애런 사무엘 (조나단 베넷 분) 에게 한눈에 반하여 그와 사귀려는 노력을 하지만 그는 바로 레지나의 헤어진 남자 친구였다. 케이디가 애런에게 관심이 있는 것을 안 레지나는 고의로 그들의 사이를 방해하고 케이디에게 모욕감을 느끼게 한다. 이 일을 계기로 케이디는 레지나를 극도로 미워하게 되고 둘 사이에는 서로상대를 꺽기 위한 숨막히는 권모술수가 동원된 팽팽한 대결이 시작되는데.,101.34,/6WcZxeBF5rOrTr7cocljvu3ET77.jpg,2004-04-30,퀸카로 살아남는 법,False,7.2,8428
False,/5AhkjcqqRxBdpYZ0TeOuTCuOUYq.jpg,"[80, 53]",429200,en,Good Time,"지적장애 동생 닉과 그의 형 코니는 그들에게 비참함을 안겨주는 뉴욕을 떠나 새로운 삶을 찾으려 은행 털이를 결심한다. 하지만 현금 2만 달러를 들고 도주하던 형제는 그들의 계획이 엉망이 되었음을 깨닫고, 동생은 홀로 구치소에 수감된다. 코니는 경찰의 수사망을 따돌리고 동생을 구하기 위해, 또 형제를 옥죄는 뉴욕으로부터 탈출하기 위해 촌각을 다투는 사투를 벌이는데...",44.955,/AiZRCsPF4HFTywgQaAOQSYaQ7ER.jpg,2017-08-11,굿타임,False,7.2,2719
False,/cUHxmWfkp6se0Rt10Kr86bMCYDE.jpg,"[18, 35, 36]",1016084,en,BlackBerry,<블랙베리>는 세계 최초의 스마트폰인 블랙베리의 급부상과 비극적인 종말에 관한 실화를 바탕으로 한 영화이다. 치열한 실리콘밸리의 무자비한 경쟁 사회를 질주하듯 보여준다.,26.679,/nQSvHZDuMlrZdm7ooMo8gb4CXhW.jpg,2023-02-13,블랙베리,False,7.196,432
False,/zBkHCpLmHjW2uVURs5uZkaVmgKR.jpg,"[10751, 12, 35, 14, 16]",585245,en,Clifford the Big Red Dog,"뉴욕의 아파트로 이사 온 12살 소녀 에밀리. 새로운 학교에 고군분투하는 에밀리를 바쁜 엄마는 출장을 가면서 철없는 삼촌 케이시에게 맡기고 떠난다.  마법 동물 구조 센터를 지나던 에밀리는 운명처럼 작고 빨간 강아지를 만나게 되고, 우여곡절 끝에 함께하게 된다. 하지만 기쁨도 잠시, 작고 빨간 강아지 클리포드는 하루 아침에 3M가 넘게 커져버려 순식간에 뉴욕의 유명인사가 되어버린다. 엄마가 오기 전 클리포드를 되돌리려는 에밀리와 클리포드를 유전학 사업에 이용하려는 기업까지 뒤쫓으며 클리포드는 위험에 빠지고 마는데..!",49.238,/95UXYFmoZiuChdC3qCo2jXdHGi8.jpg,2021-11-10,클리포드 더 빅 레드 독,False,7.188,1678
False,/9S2Id7rzj5B9MEI1CnpUHnf24cS.jpg,"[12, 16, 35, 10751]",213121,en,Toy Story of Terror!,보니와 보니 엄마는 할머니 집에 가기 위해 트렁크 안에 보니의 장난감과 짐을 싣고 떠난다. 장난감들은 트렁크 안에서 공포 영화를 감상한다. 그런데 중간에 바퀴의 바람이 빠지고 만다. 보니 엄마는 길가에 있는 모텔에서 하루를 묵기로 한다. 보니와 보니 엄마가 잠든 걸 확인한 장난감들은 모텔에 뭐가 있는지 확인하기로 한다. 그러자 자꾸만 프리클팬츠가 공포 영화 얘기를 꺼내 장난감들을 겁을 준다. 그런데 이상하게도 프리클팬츠의 얘기처럼 장난감들이 하나씩 없어지기 시작한다.,1.161,/oPBEnNP4Fg4gv9c0KBhchmtoG4H.jpg,2013-10-16,토이 스토리: 공포의 대탈출,False,7.2,893
False,/zHkQEQzoLAJwlMif4QJP1jjbsky.jpg,"[18, 10749]",330483,en,The Choice,"사랑하게 될 줄 몰랐던 그때, 헤어지게 될 줄 몰랐던 그때, 두 연인 앞에 끊임없이 계속된 ‘선택’, 이번 가을, 단 하나의 러브 스토리가 온다!",26.118,/tbKF8nxZ4rbrPBDlvpCpWYdP4cU.jpg,2016-02-04,초이스,False,7.181,1826
False,/s3E7WrOEgqYvA8ycAccqhtda95i.jpg,"[28, 12, 16, 14, 878]",15359,en,Wonder Woman,"Themyscira의 신비한 섬에서, 자랑스럽고 치열한 전사의 Amazons 경주는 말없는 아름다움, 은총과 힘을 가진 딸을 키 웠습니다 : Diana Princess. 육군 전투기 조종사 인 스티브 트레버 (Steve Trevor)가 섬에 충돌하자, 반역적이고 강력한 단호한 다이아나는 Trevor를 문명에 동행시킴으로써 아마존 법을 무시합니다. (구글번역)",21.246,/u6sI0yLJXkmrbSJzVRCmmfa4nhx.jpg,2009-03-03,원더우먼,False,7.177,532
False,/pNGrPhlOt76pkC5VAPR76mQrgin.jpg,"[10749, 35, 18]",16562,en,The Cutting Edge,"한쪽 눈을 실명해서 유명세를 뒤로하고 은반을 떠났던 덕 도로시(Doug Dorsey: D.B. 스위니 분)에게 어느날 재기의 기회가 주어진다. 피겨 스케이팅 전미 챔피언 케이트 모슬리(Kate Mosley: 모이라 켈리 분)와 한팀이 되어 아이스하키 대신 피겨 스케이팅으로 은반 위에 다시 서게 된 것이다. 케이트 또한 자신의 실수로 올림픽 메달 획득에 실패한 후 새로운 파트너를 만나 새 출발의 계기로 삼고자 한다.  처음 두 사람은 사사건건 말다툼을 하지만 그들의 코치 안톤 팜첸코((Anton: 로이 도트라이스 분)의 정열적인 지도와 피나는 노력으로 조금씩 한팀으로 호흡을 맞춰간다. 심판의 편파적 판정에도 불구하고 올림픽 출전권을 따낸 이들에게 코치는 비장의 기술인 팜윈코 트위스트를 전수하지만, 어느덧 두 사람은 서로에 대한 싹트는 감정과 이로 인한 질투로 인해 고난도 기술은 여러 문제점이 드러난다. 하지만 출전 직전 두 사람은 서로 사랑을 고백하고, 격려하며 올림픽 메달에 도전한다.",25.22,/zs9F90g0Sh9o7KabExnzzI3QTjU.jpg,1992-03-27,사랑은 은반 위에,False,7.172,320
False,/5fJm5AqRyHRgEfBVwOixyGWAoxk.jpg,"[35, 10752, 10749]",9660,en,Operation Petticoat,,31.411,/pIsm8JvpFZidVxKexv5UgoCjwpZ.jpg,1959-12-05,오퍼레이션 페티코트,False,7.167,332
False,/iKO7UEnXJUumjbjNwP4719n7vds.jpg,"[28, 80, 53, 10749, 18]",916,en,Bullitt,"시민들로부터 신망을 얻고 있는 샌프란시스코 경찰서 경위 프랭크 블리트(Detective Lieut. Frank Bullitt: 스티브 맥퀸 분)는 어느날 시카고에서 온 존 로스(Johnny Ross: 팻 레넬라 분)란 자를 48시간동안 보호하는 임무를 맡는다. 존 로스는 통신사를 운영하며 모은 정보로 범죄 조직을 협박한 자로 상원 의원인 찰머즈(Walter Chalmers: 로버트 본 분)가 범죄 소탕을 위해 그를 증인석에 세우는 대신 신변 보호를 보장한 것. 그러나 보호도중 범죄 조직원의 급습으로 존 로스는 중상을 입고 끝내는 병원에서 숨지게 된다. 살인범을 잡으려는 블리트 경위는 사건이 종결되지 못하도록 존 로스의 시체를 빼돌리며 수사를 계속하는데, 마침내 경찰을 신뢰하지 못한 존 로스가 자신과 닮은 앨버트 레닉이란 자를 대신 내세워 자신의 신변을 보호하려했음이 밝혀진다.",38.113,/uDg7tHvK8aFcG6DkN5eHiZAurOU.jpg,1968-10-17,블리트,False,7.162,1063
False,/5pMy5LF2JAleBNBtuzizfCMWM7k.jpg,"[10752, 18, 28]",653851,en,Devotion,미 해군 최초의 흑인 파일럿 제시 브라운. 한국 전쟁에서 위험을 무릅쓴 비행에 나선다. 그리고 그의 곁에는 생사를 함께하는 윙맨 톰 허드너가 있다.,44.182,/hr3pwgybefqvtrGJ57mu1MmMdWu.jpg,2022-11-23,디보션,False,7.156,646
False,/ap6Zc5NDOfbZaMhkRDyghbGeLf0.jpg,"[27, 53, 14]",501170,en,Doctor Sleep,"어린시절 아버지가 남긴 트라우마에서 벗어나지 못한 대니는 자신이 가진 샤이닝 능력으로 죽음을 앞둔 이들을 돕는 닥터 슬립으로 불리며 살고 있다. 우연히 누구보다 강력한 샤이닝 능력을 지닌 12살 소녀 아브라 스톤을 만나게 되면서, 샤이닝 능력자들을 먹고 영원한 생명을 이어나가는 트루 낫이라는 비밀조직과 맞서게 되는데…",106.469,/zcXjQEHfwuHrZKzpbrCPGnpPNtk.jpg,2019-10-30,닥터 슬립,False,7.15,4208
False,/shl0ELODK3VgHr7pu8VTz2a8olW.jpg,"[28, 18]",10617,cn,黃飛鴻,"1875년, 청조 광서제 시대. 중국 또한 근대화의 바람에 휩쓸리고 있었다. 세상의 혼란스러움은 민생의 파탄을 부른다. 힘있는 사람들이 벌이는 싸움은 힘없는 국민에게 아픔과 고통만을 더해줄 뿐이다. 중국의 젊은이를 샌프란시스코에 값싼 노동자로 팔아 치우고 있는 잭슨 일당의 나쁜 행위를 알아낸 황비홍은 이를 저지하기로 결심한다.",25.93,/mYmD05nNCbC2lzWUZwum2lz7Gzv.jpg,1991-08-15,황비홍: 천하무인,False,7.146,397
False,/nv9m0B29HrQNfebAD6IQ71Rcu6K.jpg,"[18, 10749, 35]",9441,en,Stepmom,"이자벨(Isabel: 줄리아 로버츠 분)의 아침은 분주하게 시작된다. 장난꾸러기 벤(Ben: 리암 에이켄 분)이 사라져버리기 때문이다. 그러나 애나 역시 만만치 않다. 사춘기인 그녀는 아버지의 여자친구 이자벨에 대해 거부감을 노골적으로 드러낸다. 이자벨은 현장에서는 가장 촉망받는 프로페셔널 사진작가로서 그 어떤 클라이언트도 그녀의 작업에 불만을 품은 적이 없었다. 그런 그녀가 집에서는 무능함 그자체. 잠시라도 한눈을 팔면 이내 사라져버리는 말썽꾸러기 벤과 예민하고 고집스러운 똑똑이 안나(Anna: 레나 말론 분) 때문이다.  이 두 사람의 양대 산맥 속에서 아옹다옹하는 하루가 시작된다. 그런데 여기에 루크(Luke: 에드 해리스 분)의 전처 재키(Jackie: 수잔 서랜든 분)가 가세하여 아이들에게 철저하게 희생함으로써 이자벨을 더욱 따돌리게 만든다. 한번도 어머니가 되고자 한 적이 없었고, 지금도 양육에는 학점 제로인 이자벨에게 인생은 고달프고 생활은 소란스럽다. 아이들에게 점수를 따기 위해 강아지를 사주고, 동화책도 읽어주고, 벤의 마술 실험 대상자도 되어보지만 아이들은 철옹성이다. 더구나 재키는 사사건건 이자벨이 아이들을 다루는 방식을 비난한다. 이제 어떻게 해야할 것인가. 루크에 대한 사랑 때문에 아이들을 포용하려고 했지만 역시 자신을 배척하는 아이들에 대해서 애증이 교차하고. 그러나 이제 더 이상 참을 수 없다고 소리를 지르려는 찰나, 새로운 문이 열린다. 이자벨과 재키가 마주 앉을 때, 새로운 사랑과 우정이 싹트기 시작한다.",43.096,/1bBiApUkRfzislORsl07d6XXYsT.jpg,1998-12-25,스텝맘,False,7.141,1373
False,/kCQKdkfNc7Smox53QRalBO3Doe0.jpg,"[10751, 16]",129533,en,Barbie: The Princess & The Popstar,,28.983,/hab6ZMC3eXj9pQHlSxNUjonphCR.jpg,2012-09-13,바비 프린세스와 팝스타,False,7.1,572
False,/kYgQzzjNis5jJalYtIHgrom0gOx.jpg,"[16, 28, 10751, 35, 14]",1011985,en,Kung Fu Panda 4,"마침내 내면의 평화… 냉면의 평화…가 찾아왔다고 믿는 용의 전사 ‘포’ 이젠 평화의 계곡의 영적 지도자가 되고, 자신을 대신할 후계자를 찾아야만 한다. “이제 용의 전사는 그만둬야 해요?” 용의 전사로의 모습이 익숙해지고 새로운 성장을 하기보다 지금 이대로가 좋은 ‘포’ 하지만 모든 쿵푸 마스터들의 능력을 그대로 복제하는 강력한 빌런 ‘카멜레온’이 나타나고 그녀를 막기 위해 정체를 알 수 없는 쿵푸 고수 ‘젠’과 함께 모험을 떠나게 되는데… 포는 가장 강력한 빌런과 자기 자신마저 뛰어넘고 진정한 변화를 할 수 있을까?",986.656,/1ZNOOMmILNUzVYbzG1j7GYb5bEV.jpg,2024-03-02,쿵푸팬더 4,False,7.13,1631
False,/hjA7kpsb1g2MyCfHJfPhjI0k03n.jpg,[18],10876,en,Quills,나폴레옹 황제가 통치하던 시대의 프랑스  가학적이고 문란한 성생활 때문에 정신병원에 수감된 사드 후작(제프리 러시)은 그 안에서도 자신의 욕망을 소설로 써 내려 간다. 그는 젊은 세탁부 마들렌(케이트 윈슬렛)을 통해 원고를 몰래 출판하기까지 한다.  이상주의에 불타는 병원 원장 쿨미어 신부(와킨 피닉스)는 그런 사실을 모르는 채 사드를 교화하려 하지만 나폴레옹은 잔인한 치료로 악명 높은 의사 꼴라(마이클 케인)를 병원에 파견한다.  꼴라는 점잖은 외모 뒤에 위선과 죄악을 감추고 있는 인물이었는데...,24.484,/AvGdw3BpvJV2wHmK2qY0N7XHqET.jpg,2000-11-22,퀼스,False,7.126,617
False,/5HjzYTihkH7EvOWSE7KcsF6pBMM.jpg,"[10751, 35, 12, 16]",522478,en,Peter Rabbit 2: The Runaway,토끼 피터가 도시에서 만난 나쁜 친구들로 인한 위기를 극복하는 과정을 다룬 애니메이션,46.185,/cycDz68DtTjJrDJ1fV8EBq2Xdpb.jpg,2021-03-25,피터 래빗 2: 파 프롬 가든,False,7.12,757
False,/anNPpdQshHGvzgSLw2eQHJ6JWNB.jpg,[35],37767,it,Un sacco bello,,10.288,/aZF4GkVU2AN7pSHEcKqTTp8Si3.jpg,1980-01-19,Un sacco bello,False,7.116,385
False,/4ppGUPBhWrMdYlIiJFmkplRQ9KJ.jpg,"[10749, 18]",14533,en,Gia,"필라델피아의 평범한 식당 웨이트레스인 지아는 중성적이고 과감한 성격과 매력적인 몸매를 가지고 뉴욕의 모델계에 데뷔하게 된다. 그녀는 곧 유명해지기 시작하고, 바쁘고 화려한 모델생활을 누린다. 70년대 말 최고의 모델로 불리던 지아는 스튜디오 54, 화려한 패션쇼장, 마약에 지든 게이 파티장, 슬럼가 등을 오간다. 사진 촬영장에서 메이크업 아티스트 린다와 만난 그녀는 자신이 동성애적 기질을 지니고 있음을 깨닫는다. 지아는 자신이 원하는 사람은 남자든 여자든 모두 품을 수 있었다. 그러나 그녀가 진실로 사랑했던 대상은 린다였다. 톱모델로서 부러울 것이 없던 지아는 어린 시절의 불행한 기억과 모델로 일하면서 느꼈던 외로움과 고독을 이겨내기 위해 마약과 난잡한 성생활에 빠져든다. 그러다 결국 마약에 찌든 26세의 레즈비언 슈퍼모델 지아는 짧지만 불꽃같았던 삶을 AIDS로 마감하게 된다.",28.771,/oFi5OIvBf59W1KFaN0cuiMEEbs1.jpg,1998-01-31,지아,False,7.112,703
False,/pfcj8IYB5bK8RTWiHwOCGfIzVw6.jpg,"[18, 14, 53]",845222,ko,킹덤: 아신전,비극과 배신이 삶을 덮친다. 기이하고 불길한 뭔가를 발견한다. 한순간에 가족과 동족을 잃은 여인. 오직 복수를 꿈꾸며 살아온 그녀가 짙은 어둠을 마주한다.,32.39,/dBz61uAt6xjJt4yqhiZXQt0a1bB.jpg,2021-07-23,킹덤: 아신전,False,7.105,512
False,/iFPpb2KIWKwBfyqSJivE4JegFPP.jpg,"[16, 10751, 14]",10895,en,Pinocchio,인형 제작자인 제페토는 별을 바라보면서 남자 아이 인형인 피토키오가 정말 사람이 되었으면 하고 기원한다. 그 날 밤 푸른 요정이 제페토의 작업장에 나타나 피노키오에게 아직은 인형 모습 그대로이지만 살아서 움직이게 만든다. 요정은 피노키오에게 그가 용감하고 비이기적이고 진실함을 증명할 수 있다면 그가 진짜 소년이 될 것이라 이야기한다. 피노키오의 첫 번째 시련은 제페토가 피노키오를 학교에 보내면서 닥친다. 학교로 가는 도중 피노키오는 워딩톤 파울펠로라는 이름의 교활한 여우를 만난다. 그와 그의 동료인 기데온은 피노키오가 학교를 때려치우고 연극계로 진출토록 설득하는데...,82.616,/sjVN0UhV7wJ0i3NzUitrNN38spK.jpg,1940-02-23,피노키오,False,7.1,5655
False,/ydrBuCEfMI4rxh3QFlJfXwqHEY4.jpg,"[18, 80]",476,en,Drugstore Cowboy,"마약 중독자인 밥은 그의 아내 다이앤과 친구 데이빗, 네이딘과 함께 약국을 털며 생활한다. 약국에서 가져온 약들은 환각제로 둔갑하여 그들에게 기쁨을 주기도 하고, 환각제를 찾는 이들에게 판매가 되어 돈을 벌어주기도 한다.  하지만, 밥의 뒤를 끈질기게 쫓아다니며 괴롭히는 경찰때문에 그들은 새로운 보금자리를 마련한다. 하지만, 새로운 보금 자리 역시 경찰의 감시를 벗어나기는 힘들다. 밥은 그를 감시하고 있는 경찰을 골려주려고 이웃집 남자를 부추겨 경찰에게 총을 쏘도록 꾀를 부린다.  어느 모텔에 묵고 있던 넷은, 의견충돌로 다투게 된다. 밥과 다투고, 항상 밥에게 복종하는 데이빗에게 화를 낸, 네이딘은 모텔에 혼자 남게 되고, 나머지는 병원을 털러 간다. 하지만, 병원에서의 약탈은 쉽지 않고, 이들은 간신히 병원을 빠져나온다. 모텔에 들어온 그들은 약물과다로 시체가 된 네이딘을 발견하고, 시체의 처리로 고심한다. 결국, 임시로 모텔의 천장에 숨겨두려고 하지만, 곧 이 모텔에서 지방경찰들의 행사가 열리기 때문에 방을 비워달라는 요청을 받게 된다. 사방에 경찰들로 쫙 깔린 모텔에서 어떻게 시체를 처리할지 난감한데…",20.082,/2bQXK39axyedUL6DE1pzdMYgAw1.jpg,1989-10-20,드럭스토어 카우보이,False,7.099,506
False,/x7KGocAPPBeGUzedDT6o4enBpAz.jpg,"[18, 35]",11050,en,Terms of Endearment,"1964년 휴스턴. 전 우주비행사 게릿(잭 니콜슨)이 교양 있는 귀부인 오로라(셜리 맥클레인)와 16세의 딸 엠마(데브라 윙거)네 옆집에 이사를 온다. 그 후 5년의 세월이 흘러 엠마는 플랩 호튼(제프 다니엘스)과 결혼을 하게 된다. 그러나 플랩을 못마땅하게 생각하는 오로라는 딸의 결혼식에 불참석한다. 엠마는 교사가 된 남편을 따라 아이오와로 이사를 가고, 게릿은 오로라에게 데이트를 신청하나 거절당한다. 한편 엠마는 남편의 바람기로 집을 나와 쇼핑을 하다가 샘 번스(존 리스고우)라는 은행원을 만나 그와 사귀게 된다. 오로라도 또한 전과 달리 게릿과 친해진다.그런데 이 즈음 엠마는 종양 때문에 병원에 입원하게 되는데....",24.032,/l77DRjJuykqKMtD9GTK4YT7qKHW.jpg,1983-11-20,애정의 조건,False,7.1,719
False,/uKFqdRcJ3Oe2qZscCLCZVKo1nml.jpg,"[10749, 18]",152584,fr,La Vie d'Adèle - Chapitres 1 et 2,"여느 소녀들과 다를 바 없는 평범한 고등학생 아델은 빈칸들로 점철된 미래의 답을 찾고 있는 문학소녀이다. 피에르 드 마리보의 소설 을 이해하고자 노력하고 있는 아델 앞에 어느 날 파란 머리의 대학생 엠마가 나타난다. 단지 횡단보도에서 우연히 스치며 지나친 인연이지만 그날 이후 아델과 엠마는 서로를 기억하게 된다. 누가 먼저랄 것도 없이 아델과 엠마는 서로에게 이끌리고, 미술을 전공한 엠마는 본능적으로 자신의 캔버스 안으로 아델을 초대한다. 아델은 자신과 전혀 다른 삶을 살아온 엠마로 인해 이전에는 몰랐던 뜨거운 감정을 느끼게 되는데...",36.953,/bRqQEPje0ALDUw1AhUT7FP99aap.jpg,2013-10-09,"가장 따뜻한 색, 블루",False,7.088,4445
False,/q1UjftzFqSOSMxhrqAXtoTLjQpQ.jpg,"[10749, 18]",71325,sv,Kyss mig,"올해 갓 30살이된 ‘미아’와 ‘프리다’는 서로의 부모님 약혼식에서 처음 만나게 된다. ‘미아’의 아버지인 ‘러쎄’는 ‘프리다’의 어머니인 ‘엘리자베스’와 혼인을 하게 되고, ‘미아’와 ‘프리다’는 의붓자매가 된다. ‘미아’는 현재 결혼을 약속한 남자친구 ‘팀’이 있지만, ‘프리다’에게 강하게 끌린다. ‘미아’와 ‘프리다’의 미묘한 관계는 자신들 뿐만 아니라 주변사람들까지 드라마틱한 상황에 부딪히게 하는데...",28.849,/tzzBEFFJ94h0WaJtHRLxd8kPRDM.jpg,2011-07-29,키스 미,False,7.083,326
False,/vYjZEw6g76pDXSoXTwtypr42Iyz.jpg,"[16, 10751]",13459,en,Barbie in 'A Christmas Carol',"바비와 함께하는 세상에서 가장 아름다운 크리스마스! 크리스마스 이브, 세상에 행복과 사랑이 가득한 날이지만 극장 최고의 스타이자 매력적인 디바 에덴은 크리스마스가 반갑지 않다. 크리스마스가 별 의미가 없는 그녀는 극장의 스탭들에게 크리스마스에 연습하게 하려한다. 그 날 밤, 세 명의 영혼이 그녀를 찾아오고 영혼에 이끌려 자신이 모르던 세상을 알게된 에덴, 과연 그녀는 크리스마스의 사랑과 기적을 경험하게 될까?",26.413,/fX9g1AE1JIqjX3LPPKVjcmHs6fd.jpg,2008-11-03,바비의 크리스마스 캐럴,False,7.1,527
False,/ppcLeOwKQLzg7BT1spZhaafuGL5.jpg,"[18, 10751]",1088,en,Whale Rider,"파이의 엄마는 출산 도중 쌍둥이 오빠와 숨을 거두고, 그 충격으로 아빠 ‘프로랑기’는 고향을 떠나버려 파이는 할아버지 ‘코로’, 할머니 ‘플라워즈’의 손에서 키워진다.  죽어버린 손자와 다른 삶을 사는 아들에게서 지도자가 되어 주길 바랐던 코로의 희망은 무너지고, 손녀 파이가 자라면서 뛰어난 영특함을 보이지만 지도자는 장남이어야 하는 관습때문에 그녀의 능력을 모질게 외면해 버린다. 결국, 코로는 마을의 장남들을 모아다가 훈련을 시킨 후 지도자를 뽑으려 한다. 파이는 훈련에 동참하여 할아버지에게 인정 받고 싶어하지만 코로는 그런 행동 자체가 불경하다고 질책할 뿐이다. 그러나, 파이는 자신에게 온전한 애정을 주지 않는 할아버지를 변함없이 사랑하며 눈물겹게 자신의 진심을 표현하는데...",20.787,/qQSa7Ajpq3QXe9vZMNL3hqnJvGE.jpg,2003-01-30,웨일 라이더,False,7.1,374
False,/k3TOt50cHvTLXWYPnXP0szhiXB8.jpg,"[80, 53, 18]",241,en,Natural Born Killers,"사회에 대한 불만과 증오에 가득찬 미키(우디 해럴슨)와 말로리(줄리엣 루이스)는 666번 국도를 따라 여행하는 자신들의 '허니문'에서 충동적인 살인사건을 벌인다. 미디어는 50명을 넘게 죽인 이들의 행각을 앞다투어 대서특필하고,열광한 10대들은 둘을 영웅처럼 받들며 옷차림이나 행동을 따라하기 시작하는데...",42.227,/2Lg9UrAv6MBqtUOG7cvizUDYzfq.jpg,1994-08-26,올리버 스톤의 킬러,False,7.067,3251
False,/yUyuDacqA0IhWqEbPQPXBsEIbPX.jpg,[18],661914,en,One Night in Miami...,"1964년 2월 25일, 무하마드 알리가 세계 챔피언이 되던 날 말콤 엑스를 필두로 짐 브라운, 샘 쿡 등 각계 분야의 수퍼 스타들이 한 자리에 모인다. 말콤 엑스는 자신이 꿈꿔왔던 평등한 세상에 관해 친구들을 설득한다. 자신이 활동하던 네이션 오브 이슬람에 관한 계획을 밝히는 말콤. 과연 나머지 친구들은 말콤의 생각에 어떤 반응을 보일까?",20.615,/1DLUb9PTDqXMSgsD7RmiJs7ZJIx.jpg,2020-12-25,원 나이트 인 마이애미,False,7.06,621
False,/r4hrvxb7qVlNtNpkK9QWfDzypKh.jpg,[37],12584,en,The Shootist,"전설의 총잡이 J. B. 북스는 위암을 선고받고 두 달 남짓 남은 시한부 인생을 살고 있다. 그는 여관 주인 본드 로저와 그녀의 아들을 데리고 한 마을에서 방을 잡고 조용히 죽음을 기다리지만, 그의 존재는 순식간에 마을에 화제가 된다. 어느 날, 북스와 최후의 대결을 하기 위해 한 사내가 마을로 찾아오는데...",27.968,/kDkPT4fPQA70eRdWel6G4VGtHSG.jpg,1976-07-21,최후의 총잡이,False,7.055,326
False,/eIYhSbmr8MGpEzWRRKDqojOl7Ha.jpg,"[16, 35]",13925,en,Luxo Jr.,책상 위의 스탠드 룩소에게 어디선가 공이 데굴데굴 굴러온다. 룩소는 처음에는 신기하게 생각하지만 이내 그것이 룩소 2세의 장난임을 알게된다. 그리고 룩소 2세의 장난은 점점 심해지는데….,18.987,/5IM6KmDyYX1rDPlZ4bQE617T8rZ.jpg,1986-08-17,룩소 2세,False,7.051,586
