adult,backdrop_path,genre_ids,id,original_language,original_title,overview,popularity,poster_path,release_date,title,video,vote_average,vote_count
False,/kXfqcdQKsToO0OUXHcrrNCHDBzO.jpg,"[18, 80]",278,en,The Shawshank Redemption,"촉망받는 은행 간부 앤디 듀프레인은 아내와 그녀의 정부를 살해했다는 누명을 쓴다. 주변의 증언과 살해 현장의 그럴듯한 증거들로 그는 종신형을 선고받고 악질범들만 수용한다는 지옥같은 교도소 쇼생크로 향한다. 인간 말종 쓰레기들만 모인 그곳에서 그는 이루 말할 수 없는 억압과 짐승보다 못한 취급을 당한다. 그러던 어느 날, 간수의 세금을 면제받게 해 준 덕분에 그는 일약 교도소의 비공식 회계사로 일하게 된다. 그 와중에 교도소 소장은 죄수들을 이리저리 부리면서 검은 돈을 긁어 모으고 앤디는 이 돈을 세탁하여 불려주면서 그의 돈을 관리하는데...",156.208,/qV9BQZdiM8foEzDz0Ag5hGWE5qM.jpg,1994-09-23,쇼생크 탈출,False,8.704,26148
False,/gavyCu1UaTaTNPsVaGXT6pe5u24.jpg,"[35, 18]",637,it,La vita è bella,"로마에 갓 상경한 시골 총각 귀도는 운명처럼 만난 여인 도라에게 첫눈에 반한다. 넘치는 재치와 유머로 약혼자가 있던 그녀를 사로잡은 귀도는 가정을 꾸리며 분신과도 같은 아들 조수아를 얻는다. 조수아의 다섯 살 생일, 갑작스레 들이닥친 군인들은 귀도와 조수아를 수용소 행 기차에 실어버리고, 소식을 들은 도라 역시 기차에 따라 오른다. 귀도는 아들을 달래기 위해 무자비한 수용소 생활을 단체게임이라 속이고 1,000점을 따는 우승자에게는 진짜 탱크가 주어진다고 말한다. 하루하루가 지나 어느덧 전쟁이 끝났다는 말을 들은 귀도는 조수아를 창고에 숨겨둔 채 아내를 찾아 나서는데...",57.981,/yjOqQsQHdsEZfAosZERqHiwjaty.jpg,1997-12-20,인생은 아름다워,False,8.452,12703
False,/aJCtkxLLzkk1pECehVjKHA2lBgw.jpg,"[12, 28, 878]",1891,en,The Empire Strikes Back,"제국군은 데스스타를 잃은 뒤에도 여전히 강력한 화력으로 반란군을 수세로 몰아넣었고, 반란군은 게릴라전을 위해 얼음으로 뒤덮인 행성 호스에 은신한다. 하지만 결국 제국군에 의해 호스의 반란군 기지마저 탄로나게 되고, 일행은 필사적으로 호스를 탈출해 다시 정처없는 피난길에 오른다. 반란군의 피난길에 함께 오르던 루크는 포스의 영이 된 오비완으로부터 제다이 마스터 요다를 찾아가라는 메시지를 받고 요다가 있는 정글 행성 대고바로 향한다. 루크는 요다를 만나 제다이가 되기 위한 훈련을 시작하고 솔로 일행은 제국군을 따돌리기 위해 옛 친구 랜도를 찾아가는데...",55.472,/icaO5w8uLVm4JxMew71JJrQE2YX.jpg,1980-05-20,스타워즈 에피소드 5: 제국의 역습,False,8.39,16441
False,/xLMJCCSatxENpHO9rLW9yD8A12C.jpg,"[16, 878, 28, 18]",18491,ja,新世紀エヴァンゲリオン劇場版 Air／まごころを、君に,"‘카오루’의 죽음 이후 공황 상태에 빠진 ‘신지’. 한편, 네르프 총사령관 ‘겐도’는 ‘서드 임팩트’ 즉, ‘인류보완계획’을 놓고 ‘제레’와 갈등을 벌인다. 이에 ‘제레’는 양산형 에바를 투입해 네르프 본부와 에바 파일럿들을 향해 총공격을 감행하고 맹공에 혼수 상태였던 ‘아스카’까지 완전히 폭주한다. ‘신지’는 ‘미사토’의 도움으로 겨우 초호기에 오르지만, 인류의 운명을 결정해야 하는 상황에 한계에 부딪히게 되는데…",83.775,/rS97sHvlsUAp8F6tkC78YjRU8wl.jpg,1997-07-19,엔드 오브 에반게리온,False,8.315,1492
False,/6rmb35g7XoMCMQtnbH0rUecFZlV.jpg,"[18, 10402]",10376,it,La leggenda del pianista sull'oceano,"1900년, 유럽과 미국을 오가는 버지니아 호에서 태어나 평생을 바다 위에서 살아온 천재 피아니스트 ‘나인틴 헌드레드’. 유일한 친구인 트럼펫 연주자 ‘맥스’와 첫사랑이자 마지막 사랑 ‘퍼든’, 그의 소문을 듣고 찾아온 재즈 피아니스트를 만나며 조금씩 바다 밖 세상을 배워가던 그의 인생에 새로운 변화가 찾아오는데...",29.731,/78wbKjbdIG11hVIv55g6rwgLG3l.jpg,1998-10-28,피아니스트의 전설,False,8.261,2184
False,/eNWjMbuhGxJdzaIY9ZZ2KvWx2sQ.jpg,"[16, 10751, 18, 14]",110420,ja,おおかみこどもの雨と雪,"평범한 여대생 하나는 강의실에서 우연히 만나게 된 그에게 반하게 되고, 곧 사랑에 빠지게 된다. 하지만 그는 평범한 사람이 아닌 늑대인간이었다. 늑대인간과의 동화 같은 사랑 후에 남은 것은 두 아이뿐. 눈 내리는 날에 태어난 누이 유키, 비 내리는 날 태어난 동생 아메. 두 아이에게는 커다란 비밀이 있는데, 바로 흥분하면 귀가 쫑긋, 꼬리가 쏘옥 나오는 늑대아이라는 것. 남들과 조금 다른 육아, 남들과 살짝 다른 고민을 하며 신비로운 운명을 살아가는 남매와 특별한 두 아이를 키우는 엄마의 이야기가 시작된다.",34.756,/2mF1IKMeB9JGstJqismy5AoamrV.jpg,2012-07-21,늑대아이,False,8.225,2198
False,/xBDE2d6HM1aBKQRu4IT7SfPD9fs.jpg,"[18, 9648, 878]",1124,en,The Prestige,"로버트 앤지어는 상류층 집안에서 자란 쇼맨십이 강한 마술사다. 반면 고아로 사람들과 잘 어울리지 못하는 알프레드 보든은 아이디어를 남들에게 보여 줄 배짱은 없지만 누구보다도 뛰어난 재능을 가진 천재이다. 두 사람은 서로를 아끼는 친구이자 선의의 경쟁자였지만, 그들이 최고라 자부했던 수중 마술이 실패로 돌아가면서 두 사람은 철천지 원수로 돌변한다. 서로 상대방 마술의 비밀을 캐내려 경쟁을 벌이는 가운데, 로버트는 알프레드의 비밀을 알아내기 위해 자신의 조수이자 사랑하는 여인 올리비아를 알프레드에게 접근하게 만든다.",219.798,/rwEc7SgXu7b5Yo8Co4CvSinF91v.jpg,2006-10-17,프레스티지,False,8.203,15464
False,/948wWGWLuG2ZIqRMLgfBjmm7tuR.jpg,"[18, 14, 16]",610892,ja,ヴァイオレット・エヴァーガーデン 外伝 - 永遠と自動手記人形 -,"소중한 동생을 지키는 대가로 요크 가문에 입성한 ‘이자벨라’. 더 이상 꿈도 희망도 없는 그녀의 앞에 나타난 자동 수기 인형, ‘바이올렛 에버가든’. 언니의 편지를 받고 C.H 우편사를 찾아온 ‘테일러’는 사람들에게 행복을 전하는 우편배달 일을 시작하고, ‘이자벨라’에게도 자신의 마음을 전하기 위해 ‘바이올렛’에게 대필을 부탁하는데…",27.794,/hL2mqR1jdTJ3UUyPC5w9LOrY1qQ.jpg,2019-09-06,바이올렛 에버가든 외전: 영원과 자동수기인형,False,8.179,346
False,/6aoyUbvu0419XLKLIMoH0TkEicH.jpg,"[80, 18]",103,en,Taxi Driver,트래비스는 베트남전에서 귀환한 후 불면증에 시달리며 사회에 적응하지 못하고 있다. 그래서 그는 택시 운전기사로 일하며 뉴욕의 밤거리를 다니며 타락한 사회를 보고 자신이 직접 이 악들을 제거하려고 마음 먹는다. 어느 날 트래비스는 우연히 12살 짜리 창녀 아이리스를 만나게 되고 그녀의 인생을 구하려 하지만 그녀는 집으로 돌아가길 꺼려 한다. 자신은 아무 것도 할 수 없다는 생각에 무기력해진 트래비스는 4개의 권총을 구입하고 상원의원 팔렌타인을 저격하러 나선다. 하지만 엉뚱하게도 사창가에서 피비린내 나는 총격전을 벌인 끝에 아이리스를 묶어두고 있던 포주 스포츠를 살해하고 마는데...,383.786,/nJFKg6pyfmkLKttiLQKQuLZBLKH.jpg,1976-02-09,택시 드라이버,False,8.152,11770
False,/sTp8K0SfcC2RQef1Tu160z3niHO.jpg,"[35, 10752]",935,en,Dr. Strangelove or: How I Learned to Stop Worrying and Love the Bomb,"미 공군의 잭 리퍼 장군은 공산주의자들이 미국인의 신성한 혈통을 오염시킬 음모를 꾸미고 있다는 망상에 사로잡혀 핵폭격기를 출격시킨다. 미국 대통령은 절대절명의 위기를 해결 하기 위해 자문회를 소집하는데, 그 자리에서 소련 대사는 만일 소련이 핵공격을 당한다면 지구상의 모든 동식물이 파멸되는 운명의 날이 다가오게 될 것이라고 경고한다. 전 나치주의자였던 천재 과학자 스트레인지러브 박사는 핵무기에 지구의 운명이 달려있다는 사실이 너무 명백하므로 핵무기로 상황을 대응할 수 없다는 결론을 내린다. 과연 폭격기는 제 시간에 제거될 수 있을 것인가? 아니면 잭 리퍼 장군이 전세계를 파멸시키는데 성공 할 것인가?",50.8,/2VrsnlM63ab3oAuMt3XOnbGYMY6.jpg,1964-01-29,닥터 스트레인지러브,False,8.122,5387
False,/aFmoJntgDPR0Jd8XD1ZfFSmcqMg.jpg,"[18, 10752, 9648]",46738,fr,Incendies,쌍둥이 남매인 잔느와 시몽은 어느 날 갑자기 의식을 잃은 어머니 나왈의 유언을 전해 듣고 혼란에 빠진다. 유언의 내용은 죽은 줄로만 알았던 생부와 존재조차 몰랐던 형제를 찾아 자신이 남긴 편지를 전해달라는 것. 또한 편지를 전하기 전까지는 절대 장례를 치르지 말라는 당부도 함께 담겨있다.  시몬은 유언을 따르길 거부하지만 진실이 궁금한 잔느는 지도교수의 도움을 얻어 중동에 있는 어머니의 고향으로 떠난다. 베일에 싸여 있던 그녀의 과거와 마주한 잔느. 어둠 속에 묻혀 있던 어머니의 과거의 끝에는 충격적인 진실이 기다리고 있는데...,39.528,/4j6AFF9Na494nJUMgMlR2tDKhTc.jpg,2010-09-17,그을린 사랑,False,8.101,2533
False,/w5IDXtifKntw0ajv2co7jFlTQDM.jpg,"[878, 9648, 12]",62,en,2001: A Space Odyssey,"인류에게 문명의 지혜를 가르쳐 준 검은 돌기둥의 정체를 밝히기 위해서 디스커버리호의 선장 보우만과 승무원 풀은 목성을 향해서 날아간다. 하지만 평온하던 디스커버리호에 갑자기 재난이 찾아온다. 우주선 내부에서 일어난 재난은 컴퓨터 HAL이 반란을 일으킨 것. HAL은 풀을 우주선 밖으로 던져버리고, 보우만까지도 모선 밖으로 끌어내지만 그는 필사의 노력으로 HAL을 제압한다. 보우만은 마침내 목성 궤도에서 문제의 검은 돌기둥을 발견하지만, 그 순간 우주의 급류에 휘말리게 된다. 보우만은 지구로의 귀환을 위해 노력하고, 신비한 시간의 흐름을 경험하는데...",426.828,/2qJjH5mYNlGPdVrPqfEq1J6Mgb4.jpg,1968-04-02,2001 스페이스 오디세이,False,8.078,11085
False,/5vPW6MPAyCFd84FEQQgtPDmVDPQ.jpg,"[35, 18]",120467,en,The Grand Budapest Hotel,"1927년 세계대전이 한창이던 어느 날, 세계 최고 부호 마담 D가 그랜드 부다페스트 호텔에 다녀간 지 얼마 지나지 않아 의문의 살인을 당한다. 그녀는 유언을 통해 가문 대대로 내려오던 명화 사과를 든 소년을 전설적인 호텔 지배인이자 연인 구스타브 앞으로 남긴다.  마담 D의 유산을 노리고 있던 그의 아들 드미트리는 구스타브를 졸지에 유력한 용의자로 지목하게 되고, 구스타브는 충실한 호텔 로비보이 제로와 함께 누명을 벗기기 위한 기상천외한 모험을 시작한다.",54.943,/kDByLWU30umAUyetDnmdptUMVap.jpg,2014-02-26,그랜드 부다페스트 호텔,False,8.05,14377
False,/3myXJx5wwEn1s6O95C4Vw6l5ZUk.jpg,"[35, 80]",337404,en,Cruella,"재능은 있지만 밑바닥 인생을 살던 에스텔라는 우여곡절 끝에 런던에 오게 된다. 그곳에서 운명처럼 재스퍼와 호레이스를 만난 에스텔라는 뛰어난 패션 감각을 이용해 완벽한 변장과 빠른 손놀림으로 런던 거리를 싹쓸이한다. 도둑질이 지겹게 느껴질 때 쯤, 꿈에 그리던 리버티 백화점에 들어가게 된 에스텔라. 그곳에서 런던 패션계를 꽉 쥐고 있는 남작 부인을 만나 충격적 사건을 겪게 되며, 에스텔라는 런던 패션계를 발칵 뒤집을 파격 아이콘 크루엘라로 새롭게 태어나게 되는데...",84.583,/ejnSfKiUgqyiqdiLMc1wGAwvyTN.jpg,2021-05-26,크루엘라,False,8.027,8977
False,/2vq5GTJOahE03mNYZGxIynlHcWr.jpg,"[18, 28, 36]",359724,en,Ford v Ferrari,"1960년대, 매출 감소에 빠진 포드는 판매 활로를 찾기 위해 페라리와의 인수 합병을 추진한다. 막대한 자금력에도 불구, 계약에 실패하고 엔초 페라리로부터 모욕까지 당한 헨리 포드 2세는 르망 24시간 레이스에서 페라리를 박살 낼 차를 만들 것을 지시한다. 지옥의 레이스로 불리는 르망 24시간 레이스. 출전 경험조차 없는 포드는 대회 6연패를 차지한 페라리에 대항하기 위해 르망 우승자 출신 자동차 디자이너 캐롤 셸비를 고용하고, 그는 누구와도 타협하지 않지만 열정과 실력만큼은 최고인 레이서 켄 마일스를 자신의 파트너로 영입하는데...",131.186,/wBUoWL4z0nsvC9cYT3VCc74X3jE.jpg,2019-11-13,포드 V 페라리,False,8.005,7563
False,/76LpPdXtCf4WxWDagVT2YcF4e9g.jpg,"[10752, 28, 18, 36]",530915,en,1917,제1차 세계대전이 한창인 1917년 4월 6일. 독일군에 의해 모든 통신망이 파괴된 상황 속에서 서부전선의 영국군 병사 스코필드와 블레이크에게 하나의 미션이 주어졌다. 독일군의 함정에 빠진 영국군 부대의 수장 매켄지 중령에게 에린무어 장군의 공격 중지 명령을 전달하라는 것. 블레이크는 데본셔 연대에 있는 형을 구하기 위해 기꺼이 임무를 수행한다. 동료인 스코필드는 처음엔 당황스러워하지만 이내 1600명의 동료들을 구하기 위해 전쟁터 한가운데를 가로지르는 여정에 동참한다.,59.934,/u2oRQqUashBBIj5UNeOd5TN0bmB.jpg,2019-12-25,1917,False,7.994,11930
False,/6zbKgwgaaCyyBXE4Sun4oWQfQmi.jpg,"[28, 53]",615457,en,Nobody,"비범한 과거를 숨긴 채 남들과 다를 바 없는 평범한 일상을 사는 한 가정의 가장 ‘허치’ 매일 출근을 하고, 분리수거를 하고 일과 가정 모두 나름 최선을 다하지만 아들한테는 무시당하고 아내와의 관계도 소원하다. 그러던 어느 날, 집안에 강도가 들고 허치는 한 번의 반항도 하지 못하고 당한다. 더 큰 위험으로부터 가족을 지키기 위한 선택이었는데 모두 무능력하다고 ‘허치’를 비난하고, 결국 그동안 참고 억눌렀던 분노가 폭발하고 만다.",299.756,/oXQtH8O7pCvXaDKGB8OAjiPVDi5.jpg,2021-02-26,노바디,False,7.971,6721
False,/hGGC9gKo7CFE3fW07RA587e5kol.jpg,"[16, 35, 10751, 12]",14160,en,Up,"평생 모험을 꿈꿔 왔던 칼 할아버지는 재개발 공사 현장의 인부를 실수로 다치게 하고 집을 빼앗길 위기에 처한다. 그 동안 미뤄 왔던, 먼저 세상을 떠난 아내와의 약속을 지키기 위해 그는 수천 개의 풍선을 매달아 집을 통째로 남아메리카로 날려 버린다. 하지만 이 위대한 모험에 초대 받지 않은 불청객이 있었으니, 바로 황야의 어린이 탐험가 러셀. 우여곡절 끝에 도착한 남미에서 칼은 어린 시절의 우상이었던 위대한 모험가 찰스 먼츠를 만나게 되는데... 그들은 과연 남미의 잃어버린 세계에서 사라져 버린 꿈과 희망, 행복을 다시 찾을 수 있을까?",169.247,/lL2WzkjLZP0RkPgUhybBjb9x9SL.jpg,2009-05-28,업,False,7.958,19617
False,/8lBcqakI3F19NWkXdqE0M8W76b9.jpg,"[28, 18, 36, 10752]",197,en,Braveheart,"13세기 말, 스코틀랜드 왕이 후계자 없이 죽자 잉글랜드는 왕권을 요구하며 스코틀랜드에 포악한 정치의 그림자를 드리우기 시작한다. 윌리엄 월레스(멜 깁슨)는 폭정을 피하여 멀리 보내져 양육된다. 그가 성장하여 고향에 돌아왔을때 스코틀랜드는 여전히 잉글랜드의 군주 롱생크(패트릭 맥구한)의 핍박과 탄압에 시달리고 있었다. 그는 운명적인 사랑의 여인 머론(캐서린 맥코맥)을 만나 결혼하지만, 잉글랜드의 폭정에 머론은 잔인하게 처형된다. 월레스는 머론의 복수를 다짐하고, 하나 둘씩 모여드는 스코틀랜드 사람들을 모아 용맹과 투지로 무장한 저항군의 지도자가 되는데...",61.463,/3aEg4uxWUJsd1Mcx6TaQAlxZiyZ.jpg,1995-05-24,브레이브하트,False,7.94,9777
False,/l2iY1AgqQ8dEa3FtWkN5TQ5aVbU.jpg,"[53, 9648]",1092,en,The Third Man,"2차 대전 직후 미국의 소설가 홀리 마틴스는 친구 해리의 연락을 받고 빈에 도착한다. 그를 반긴 것은 해리가 교통사고로 죽었다는 소식. 홀리는 친구의 애인 안나를 만나고 해리가 가짜 페니실린을 밀매했다는 혐의로 연합군의 추적을 받아왔음을 알게 된다. 친구의 죽음을 의심하던 홀리 앞에 홀연히 나타나는 해리. 홀리는 가짜 페니실린으로 고통받는 사람들을 접하고 해리를 체포하려는 칼로웨이 소령에게 협조하기로 결심한다. 그레이엄 그린의 원작 소설을 영화로 만든 작품.",80.798,/oIF3l7Dxp7Eyye10BNyM611wtKa.jpg,1949-08-31,제3의 사나이,False,7.9,1763
False,/78F8cn6EXum1zpukF3HTNI8W0EA.jpg,"[16, 18, 35]",13398,ja,東京ゴッドファーザーズ,"까칠한 아저씨 긴과 여자를 꿈꾸는 남자 하나, 십대 가출 소녀 미유키는 하루하루 대충~살아가는 홈리스들. 흰 눈이 내리는 화이트 크리스마스에도 언제나처럼 쓰레기를 뒤지던 그들은 버려진 아기 ‘키요코’를 발견하게 된다. 키요코가 하늘이 보내준 천사라 생각한 홈리스 트리오는 아기천사에게 따뜻한 집을 찾아주겠다는 불타는 사명감으로 길을 나서는데...",23.132,/jsu6iZwbaa6NxyrwyNl1XL6JUZb.jpg,2003-12-05,크리스마스에 기적을 만날 확률,False,7.914,1198
False,/nofXR1TN1vgGjdfnwGQwFaAWBaY.jpg,"[35, 18, 10749, 10402]",313369,en,La La Land,"차들로 빽빽이 들어찬 LA의 고속도로. 거북이 걸음이던 도로가 뚫리기 시작하지만 미아 지금 손에 든 연기 오디션 대본을 놓지 못한다. 세바스찬은 경적을 누르며 미아를 노려보고는 사라진다. 악연의 시작. 이후 미아는 감미로운 피아노 선율에 이끌려 재즈바로 향하는데, 연주자가 바로 세바스찬이다. 미아가 세바스찬에게 인사를 건네려고 다가가던 순간은 하필 그가 재즈바의 레퍼토리를 무시하고 연주한 탓에 해고된 직후. 세바스찬은 인사를 건네려 다가온 미아를 쌩하니 스쳐 지나가버린다. 세 번째로 두 사람은 파티에 온 손님과 출장 밴드의 키보드 연주자로 다시 만나는데...",65.538,/ad9ndytwOckyShSc0A6tx1rZRkW.jpg,2016-11-29,라라랜드,False,7.902,16323
False,/rcEUuRtr0dFL078bNeXL8pQqrMK.jpg,"[18, 27, 53]",827,fr,Les Diaboliques,"자신의 아내인 크리스티나의 돈으로 구입한 기숙사 학교의 교장 노릇을 하고 있는 미셸 들라살은 아내에게 폭행과 모욕을 일삼는 잔혹하고 인색한 사람이다. 한때 수녀이기도 했던 여리고 착한 여자인 크리스티나는 그런 남편의 구박에 하루도 편할 날이 없다. 그러던 어느 날, 미셸의 정부이자 학교 선생인 니콜 오르네가 크리스티나를 찾아와 미셸을 함께 살해하자고 제안한다. 둘은 학기 중 쉬는 기간을 이용해 니콜의 고향으로 가 이혼하고 싶으니 돈을 돌려달라는 말로 미셸을 유인한다. 격분한 미셸이 달려오고, 두 여자는 독이 든 와인을 마시게 해 쓰러진 미셸을 욕조에 빠뜨려 익사시킨다. 그리고 미셸이 술에 취해 사고로 익사했다고 만들기 위해 학교로 돌아와 시체를 수영장에 던져버린다. 하지만 미셸의 시체는 떠오르지 않고, 크리스티나는 점점 불안과 공포에 시달리게 된다. 결국 크리스티나는 수영장의 물을 다 빼내고 시체를 확인하기로 한다. 그러나 시체는 감쪽같이 사라져 버리고 없다. 그때부터 미셸이 입고 있던 옷이 세탁소에서 배달되는 등 미셸이 살아있다고 믿어질 만한 이상한 사건들이 연속적으로 일어난다.",23.396,/6wmNcHjXnBEhlAvsUUR6ytdLKHO.jpg,1955-01-29,디아볼릭,False,7.891,906
False,/ww6f0XEn8aUbNsK1OQGdutJWwQf.jpg,"[10749, 18, 10402]",369557,en,Sing Street,"‘코너’는 전학을 가게 된 학교에서 모델처럼 멋진 ‘라피나’를 보고 첫 눈에 반해 사랑에 빠진다.  ‘라피나’에게 잘 보이고 싶은 마음에 덜컥 밴드를 하고 있다는 거짓말을 한 ‘코너’는  급기야 뮤직비디오 출연까지 제안하고 승낙을 얻는다.  날아갈 것만 같은 기분도 잠시,  ‘코너’는 어설픈 멤버들을 모아 ‘싱 스트리트’라는 밴드를 급 결성하고  ‘듀란듀란’, ‘아-하’, ‘더 클래쉬’ 등 집에 있는 음반들을 찾아가며 음악을 만들기 시작한다.  첫 노래를 시작으로 조금씩 ‘라피나’의 마음을 움직인 ‘코너’는  그녀를 위해 최고의 노래를 만들고 인생 첫 번째 콘서트를 준비하는데…  첫 눈에 반한 그녀를 위한 인생 첫 번째 노래!  ‘싱 스트리트’의 가슴 설레는 사운드가 지금 시작된다!",139.273,/kUYfLv9V5mKPb2lJadzgOI67AFt.jpg,2016-03-11,싱 스트리트,False,7.872,2205
False,/bskmLsrwmpqvZxKDi81UHa4mFDx.jpg,"[28, 18, 80]",944401,fr,Dogman,"뉴저지의 한 도심, 핑크 드레스에 짙은 화장을 한 남자가 수백 마리의 개와 함께 긴급 체포된다. 아무런 진술도 하지 않던 그는 정신과 의사에게 15년간의 이야기를 털어놓기 시작하는데... 신마저 외면했지만 개를 통해 구원받은 한 남자의 처절하고 아름다운 이야기가 펼쳐진다!",111.987,/ggEVrwwk68QBcygzvzCV0fvRLEY.jpg,2023-09-27,도그맨,False,7.858,805
False,/7KGdTzKux4fp5sW7hUM33NWqBU1.jpg,"[12, 28]",89,en,Indiana Jones and the Last Crusade,자신이 재직 중인 바네트 대학으로 돌아온 인디는 몇 달만을 비워뒀던 대학 연구실에서 오래 전에 도착한 아버지의 일기장을 발견한다.  고고학에 관심 많은 학생들을 피해 겨우 창문으로 빠져나온 존슨 박사는 윌터 도노반이라는 사람을 만난다. 도노반은 자신이 앙카라 북쪽에서 발견한 반쪽짜리 신의 석판의 탁본을 보여주며 헨리 박사의 일기장을 참고로 나머지 반쪽 석판과 예수가 최후의 만찬 때 사용했다는 술잔 성배를 찾아 달라고 부탁한다. 인디아나 존스는 아버지 헨리 존스 박사가 나치에게 납치 되었다는 소식을 듣고 베니스로 달려가는데...,79.067,/nbNr6vea9nkedkozeR3ZzoQm12A.jpg,1989-05-24,인디아나 존스: 최후의 성전,False,7.848,9767
False,/tLoCvK6BHqeGOQ5MzfH8HVFKYoE.jpg,"[53, 10770, 18, 9648]",185789,en,Mulholland Dr.,,15.465,/oGXtT5UW8lDWt8uxlww2zw9GmBs.jpg,1999-01-01,Mulholland Dr.,False,7.838,461
False,/59vDC1BuEQvti24OMr0ZvtAK6R1.jpg,"[14, 12, 16, 10751]",10191,en,How to Train Your Dragon,"바이킹의 세계, 절대 친구가 될 수 없는 둘이 만났다?  용맹한 바이킹과 사나운 드래곤들의 싸움이 끊이지 않는 버크섬.  바이킹 족장의 아들 ‘히컵’은 드래곤 사냥에 소질 없는 마을의 사고뭉치. 어느날 그는 부상 당한 드래곤 ‘투슬리스’를 구하게 되고, 아무도 몰래 그를 돌본다. 서로를 알아가며, 드래곤들의 친구가 된 ‘히컵’. 그들과의 새로운 생활을 만끽하던 ‘히컵’은 드래곤들의 위험한 비밀을 알게 되는데…  불멸의 드래곤과 바이킹족 이단아의 만남!  2010년 5월, 그들의 스펙터클한 모험이 시작된다!",101.235,/5JtTkNwOeztwfCPv965e9bZi6G3.jpg,2010-03-18,드래곤 길들이기,False,7.824,12589
