adult,backdrop_path,genre_ids,id,original_language,original_title,overview,popularity,poster_path,release_date,title,video,vote_average,vote_count
False,/oMaj75G2WFw66xI1TREg1hrToSg.jpg,"[28, 14, 878, 12]",268896,en,Pacific Rim: Uprising,"전 세계를 초토화시켰던 전쟁 이후, 지구 종말의 위기가 다시 찾아온다.  더 강렬하게 진화한 적들의 공격이 인류의 재앙을 불러오고  최정예 파일럿과 업그레이드 된 거대 로봇 예거 군단은 사상 최대의 반격을 시작한다.  하지만 아무도 예상치 못했던 또 다른 적의 등장으로  인류는 전대미문의 위기에 봉착하게 되는데...",67.906,/3HNCO7bLihIj1icRL9RLPY215KW.jpg,2018-03-21,퍼시픽 림: 업라이징,False,6.134,4766
False,/z9NxO5sgLPYOQDT3h3w6qx3FAGq.jpg,"[35, 27]",419479,en,The Babysitter,12살 소년 콜에게 새 베이비시터가 왔다. 섹시한 건 좋은데 피 범벅의 숭배 의식? 베이비시터의 비밀을 알게 된 콜과 입막음하려는 그녀의 추종자들. 전쟁은 시작됐다!,131.206,/86a7GRVRCwfl7wdI4QadyvKa6Zu.jpg,2017-10-13,사탄의 베이비시터,False,6.132,3458
False,/7xyjib3y0Sb87gcsaANoiE9KoRL.jpg,"[28, 12, 18]",20187,en,The Eiger Sanction,"미술사학 교수인 햄록 박사(클린트 이스트우드)는 사실 첩보기관에서 살인청부업자로도 활동하고 있다. 교수 월급으로 수많은 미술 진품들을 집에 소장할 수 있었던 데는 그로 인한 수입이 엄청났기 때문이다. 뿐만 아니라 그는 학생들에게도 인기가 많으며 자유롭게 연애를 즐기며 산다. 그런 그에게 ‘드래곤’으로부터 새로운 지령이 떨어진다. 거절하고 싶었지만 지마이마(보네타 맥기)의 유혹으로부터 자유롭지 못했고 나중에 지마이마가 드래곤으로부터 고용된 사람이라는 것을 알고 충격에 빠진다. 그렇게 드래곤의 지령을 수행하지만 또 다시 새로운 지령이 떨어진다. 이번에는 너무나 큰 금액이라 거절하지 못한다. 아이거 빙벽 등반대 중 한 명을 암살하는 것. 하지만 과거 그는 아이거 빙벽에서 두 번이나 그냥 돌아온 전력이 있다. 이제 그는 오랜 친구 벤(조지 케네디)의 도움으로 등산을 하고 체력을 단련하며 몸을 만든다. 그 와중에 자신을 배신했던 옛 친구가 그곳으로 찾아오는데 그 역시 처단하고 만다. 그렇게 훈련을 마치고서 스위스에서 아이거 빙벽 등반을 위한 다른 대원들과 합류하게 된 그는 자신을 제외한 세 명의 등반 대원 중 한 명의 스파이를 찾아내 제거하는 임무를 본격적으로 수행한다. 나이 든 교수와 그의 부정한 아내, 그리고 젊고 패기 넘치는 두 남자 사이에서 누가 스파이인지 알아내는 것은 쉽지 않다. 게다가 지마이마까지 다시 만나게 된다. 그렇게 등반은 시작되고 그들은 악천후 속에서 힘겨운 싸움에 나선다.",22.208,/8654SvWhTdWQZ84C4NlidPqMBTB.jpg,1975-05-21,아이거 빙벽,False,6.1,368
False,/s7tRhQ8oDJSdsy3YvDp04KtK9nC.jpg,"[10770, 35, 10751]",278774,en,Zapped,"엄마가 재혼하면서 조이는 지저분하고 정신 사나운 집에서 시끄러운 새아빠, 그리고 사고뭉치 3형제와 함께 살게 된다. 그러던 중 우연한 사고로 조이는 남자들을 마음대로 조종할 수 있는 마법의 앱을 갖게 된다. 정신없는 삶에서 벗어날 수 있는 기회에 신이 난 조이는 남자들을 조종해 바르게 행동하게 하지만, 남자들이 남자가 아니게 되면 완전히 새로운 골칫거리가 생긴다는 사실을 깨닫게 된다.",25.157,/bTtRYxj8rPOMoAu8XpeQ509CrtT.jpg,2014-06-27,조이의 비밀앱,False,6.1,597
False,/7FQHLt4iNh2TZ58cAAYrZK0xogg.jpg,"[18, 35]",575417,en,On the Rocks,"갑작스럽게 남편의 외도가 의심되자, 아내(라시다 존스)는 전설적인 플레이보이였던 아버지(빌 머레이)와 함께 뉴욕 곳곳을 다니며 남편(말론 웨이언스)을 미행한다.",18.557,/fcijRCmB7yTtloh4Pumy9b1rkwU.jpg,2020-10-02,온 더 락스,False,6.116,633
False,/3xJFFU3YF9WcpK2WXDF15zVcSQZ.jpg,"[35, 10749]",4967,en,Keeping the Faith,"브라이언(에드워드 노튼)과 제이크(벤 스틸러)는 맨하탄에서 함께 자란 친구. 둘 다 중산층 출신이다. 브라이언은 가톨릭 신부가 됐고 제이크는 유태교 랍비가 됐다. 지구촌 어디선가는 전쟁까지 치를 만큼 극심한 차이를 보이는 두 종교의 대표급 선수가 됐지만 두 사람의 우정은 별로 흔들림이 없다. 오히려 둘은 힘을 합쳐 노인 사교 클럽을 운영할 계획까지 세운다. 두 사람 모두 엄격한 규율에 얽매이지 않는 자유롭고 진보적인 설법으로 신도들에게도 큰 인기를 차지하고 있다. 모범적인 종교화합. 성직자로서 두 사람의 인생은 탄탄대로처럼 보였으나, 애나의 등장과 소개팅 등의 일련의 사건으로 제이크와 브라이언은 신앙과 우정에 위기를 맞이하고, 친구로서, 연인으로서, 성직자로서 심한 갈등과 고뇌에 빠지는데...",20.993,/mCpsrkYgD0XapRnCEuItRqOHse1.jpg,2000-04-14,키핑 더 페이스,False,6.109,589
False,/fn6lI2tawQgHyctkAJJtQ22v4pW.jpg,"[53, 28, 35, 80]",1613,en,The 51st State,"약대 졸업식날 마약 제조 혐의로 약사 자격을 뺏긴 맥클로이는 30년 후 마약 제조자가 된다. 리자드의 수하에서 코카인보다 51배 강하고, 엑스터시보다 51배 자극적인 신소재 마약 POS-51D을 제조한 맥클로이는 세계 최고의 마약상 듀란과 거래를 위해 또 다른 음모를 꾸민다. 하지만 거래하는 날 듀란과 맥클로이는 나타나지 않고 약속장소는 폭파된다. 가까스로 목숨을 건진 리자드는 맥클로이의 배신에 분노해 미모의 킬러 다코타에게 맥클로이 제거를 명령한다.",15.267,/vbFKo3SQVTObgjyLsY8JkBp6MCl.jpg,2001-12-07,51번째 주,False,6.1,581
False,/tQeYoSH2z0vqiBff3wUHOUqyZA7.jpg,"[35, 18, 10749]",13243,en,Meet Bill,"빌(아론 에크하트)은 자신이 일하고 있는 은행이 그의 장인과 처남의 소유라는 사실에 자꾸 움츠러든다. 자신의 피부색, 헤어스타일, 튀어 나온 배.. 모든 것에 자신감을 잃고 있다. 그래서 늘 초조하거나 스트레스가 쌓이면 초콜릿을 먹는다. 어느 날 자신의 아내(엘리자베스 뱅크스)가 지역 케이블 뉴스 프로그램의 잘생긴 젊은 기자 칩 존슨(티모시 올리펀트)와 바람을 피운다는 사실을 눈치 채고 침실에 몰래 카메라를 설치한다. 꼬리가 길면 밟힌다고 아내의 부적절한 외도 행각이 카메라에 고스란히 남게 되고 문제의 동영상은 인터넷에 올라가게 되자 빌은 급기야 기자를 폭행하여 경찰서 유치장에 갇히는 신세가 된다.  다행히 쇼핑센터를 운영하는 형의 도움으로 풀려난 빌은 아내와 기자 모두에게 접근 금지 명령을 받게 되고 집에 쫓겨나는 처지에 놓이게 되지만 멘토 프로그램에 참여하게 된 한 소년으로부터 도움을 받아 여성 속옷 매장에 근무하는 루시(제시카 알바)를 소개받게 되는데…",21.771,/u5EqwPmzc40qIyUUSMvoaWVsSMc.jpg,2007-09-07,굿바이 초콜릿,False,6.1,303
False,/9v0yQeGgfhtbeg9196n9G6LMIb6.jpg,[18],347126,en,God's Not Dead 2,"고등학교 역사 교사 ‘그레이스’는 오빠를 잃은 슬픔에 빠져있는 여고생 ‘브룩’에게 성경 말씀으로 고난을 극복할 수 있음을 알려준다. 오빠의 유품에서 성경을 발견한 ‘브룩’은 오빠도 같은 길을 걸었음을 깨닫는다. 그러던 중 ‘브룩’은 역사교재 속 위인에 예수님이 빠진 것에 의구심을 갖고 ‘그레이스’에게 질문한다. 예수님 말씀을 인용해 대답을 한 ‘그레이스’. 하지만 그 답으로 인해 그녀는 큰 시련에 빠지고, 실직은 물론 엄청난 민사 소송에 휘말리게 되는데… 변호사 ‘톰’과 함께 학교 이사회와 미국 시민자유연맹에 맞선 ‘그레이스’",30.161,/1q5xO1MnpcDnCXpegg4n11wmmpe.jpg,2016-04-01,신은 죽지 않았다 2,False,6.096,390
False,/ui4PGuwc9SakCxj0qWbQZ129Uis.jpg,"[878, 35, 53, 27, 9648]",84204,en,Grabbers,"아일랜드의 한적한 섬마을인 에린 섬에, 휴가를 떠나는 경찰서장 대신 여경관 리사가 파견되고 리사는 그곳에서 함께 일할 경관인 오셔와 만나게 되는데 그는 항상 술에 취해 지내며 산다. 그러던 어느 날, 어부인 패디는 바다에서 괴생명체를 잡아오고 그 이후부터 사람들이 목만 남긴 채 죽은 시신으로 발견된다.  이를 조사하던 리사와 오셔는 괴생명체인 그래버에 대해 알게 되고 그래버를 없애기 위한 방안을 모색해 나가는데...",25.118,/ogBvR0xx1vhSGnEuumzc8SnOlSH.jpg,2012-08-10,그래버스,False,6.092,428
False,/iRHqxrythyTtORMYrczoAE5KbCA.jpg,[35],14013,en,BASEketball,"한 동네에서 자란 쿠퍼(Joe Cooper: 트레이 파커 분)와 리머(Doug Remer: 매트 스톤 분)은 엄청난 야구광으로, 유명한 스포츠 스타가 되는 것이 꿈이다. 그러나 쿠퍼와 리머는 엉뚱한 행동과 장난을 일삼는 얼간이들로 그들은 자기들이 만들어낸 야구식 농구(베이스켓볼)로 취미생활을 즐긴다. 베이스켓볼이란 농구대와 농구공을 이용한 스포츠이지만 그 경기의 규칙은 야구와 같은 것으로 쿠퍼와 리머가 만들어낸 다소 엉뚱한 스포츠다.  그러나 내기 게임을 계기로 우연히 시작된 이 경기가 친구들 사이에서 관심을 끌게 되고 시간이 지남에 따라 인기 있는 아주 유명한 스포츠가 되어 간다. 5년 후, 베이스켓볼 경기는 전국을 강타하는 스포츠 종목으로 대중적 인기를 차지한다. 또한 이 경기의 창시자인 쿠퍼와 리머는 스포츠 프로모터인 테드로부터 프로로 전향해 달라는 프로포즈를 받는다.",25.276,/oKZdAUV9XSLp091f0GmtQEu0UZy.jpg,1998-07-28,베이스켓볼,False,6.1,545
False,/5luJmy21N3bYCkjzRHsoZfvLtPP.jpg,"[18, 53]",773975,en,End of the Road,최근 남편과 사별한 브렌다는 남겨진 가족들과 자동차 여행길에 오른다. 하지만 살인 사건과 사라진 현금 가방에 얽혀 위험에 빠지는데. 끔찍한 상황 속에서 그녀는 가족을 지키기 위해 사투를 벌인다.,18.21,/tLFIMuPWJHlTJ6TN8HCOiSD6SdA.jpg,2022-09-09,엔드 오브 더 로드,False,6.1,303
False,/7CamWBejQ9JQOO5vAghZfrFpMXY.jpg,"[28, 53, 80]",928381,fr,Sans répit,극단적인 방법으로 사건을 은폐해 버린 부패 경찰. 정체불명의 목격자로부터 협박을 받으면서 그의 인생은 걷잡을 수 없는 소용돌이 속으로 빠져든다.,20.088,/d2NhlJvbXPIEalgEfI4lzd4mizb.jpg,2022-02-25,레스틀리스,False,6.072,363
False,/mWINg2BwQ2RBNIN8WSMjNbkih3d.jpg,"[35, 27]",12110,en,Dracula: Dead and Loving It,"1896년 영국에서 트린실베니아로 온 젊은 변호사 랜필드(Renfield: 피터 맥니콜 분)가 드라큐라(Dracula: 레슬리 닐슨 분) 백작의 성 근처 마을에 도착한다. 주민들은 드라큐라 백작과 사업상 만날 일이 있다는 변호사 랜필드를 보고 드라큐라 백작에게 가지 말라고 충고하지만 그는 그 말을 무시하고 드라큐라 백작을 만나러 간다.  드라큐라가 영국의 저택을 찾아 일을 도와주고 있는 랜필드는 그러나 계약서를 작성하다 종이에 베어 피를 흘리고, 드라큐라는 젊은 남자의 피를 보자 흥분한다. 결국, 랜필드에게 최면을 걸어 자신의 종으로 만든 드라큐라는 영국에 도착해 생활하게 되고, 우연히 만난 이웃집의 미나(Mina: 에이미 야스벡 분)에게 묘한 감정을 느낀다.  스스로의 초능력을 이용해 미나를 탐하던 드라큐라를 막기 위해 사람들은 대책을 세우게 되고, 결국 미확인 질병의 대가인 밴 헬싱 교수(Dr. Abraham Van Helsing: 멜 브룩스 분)를 초빙한다. 마늘과 십자가 등을 동원해 흡혈귀의 침입을 막던 밴 헬싱은 이웃집의 드라큐라가 흡혈귀일 것으로 의심하나 증거를 찾지 못한다. 드라큐라는 계속 미나의 피를 탐하고, 미나가 죽자 미나가 흡혈귀로 부활할 것을 걱정한 밴 헬싱은 미나의 가슴에 말뚝을 박아 죽여야 한다고 주장하지만 그의 아버지는 그럴 수 없다고 버틴다.  결국 미나는 흡혈귀로 부활해 사람의 피를 탐하고 밴 헬싱은 간신히 그녀의 심장에 말뚝을 박아 죽이는데 성공한다. 그러나 드라큐라는 미나의 동생을 노리고, 미나의 동생도 점점 흡혈귀로 변해간다. 밴 헬싱은 흡혈귀는 거울에 보이지 않는다는 것을 이용, 무도회를 열어 드라큐라 백작의 모습을 거울에 비춰 모습이 드러나지 않으면 죽이기로 한다.  무도회날 그들의 꾀임에 넘어간 드라큐라는 결국 정체를 드러내게 되고, 벤 헬싱은 그를 유인해 동이 트는 아침 그에게 빛을 보게 해 태워 죽이고, 그후 마을에는 평화가 돌아온다.",34.719,/4rRfZz8YnHNRr16t3CFcJrPdXHi.jpg,1995-12-22,못말리는 드라큐라,False,6.1,940
False,/nnaNos23m34yIVzHhToxhF22vt4.jpg,"[28, 53, 27]",30974,fr,Vertige,"매년 수 천명의 실종자 발생으로 암벽등반 루트가 폐쇄된 발칸반도 리스니야크산. 스릴을 즐기기 위해 끌로에, 기윰, 로익, 프레드, 까린느는 위험을 무릅쓰고 금지된 그 곳으로 향한다. 외줄 하나에 의지한 채 깎아지는 절벽을 오르며 짜릿한 모험을 만끽하는 것도 잠시. 가파른 절벽을 연결하는 950m 상공의 ‘악마의 다리’를 건너던 중, 다리가 끊어지면서 까린느가 떨어질 위험에 처한다. 간신히 로프를 던져 그녀를 구해내지만, 산의 유일한 출구가 사라지면서 갇히게 된다. 다른 출로를 찾아 헤매던 중 프레드마저 실종되고, 끌로에, 기윰, 로익, 까린느는 점차 이성을 잃고 변해간다. 자신들이 유일하다고 생각했던 여행에서 정체를 알 수 없는 무언가가 있다는 것을 알게 된 그들의 여행은 악몽으로 변해가는데... 16시간의 사투, 이제 여기서 벗어나야만 한다!",15.937,/kr0VS1ixorJSjGnW9164fmtXcln.jpg,2009-06-24,하이 레인,False,6.1,396
False,/pgx8VuStZl8JTzEpvz6AdUdaM2X.jpg,"[10751, 14, 35, 12]",10137,en,Stuart Little,"어느날 리틀씨 부부는 스튜어트라는 조그맣고 사랑스러운 생쥐를 양자로 데려오는데, 동생을 원했던 아들 조지와 귀여움을 빼앗긴 고양이 스노우벨은 그를 반가워하지 않았다. 스튜어트는 하루 빨리 가족에게 적응하려 노력하지만 쉽지만은 않다. 조지는 스튜어트를 단지 새앙쥐일 뿐이라며 그를 동생으로 인정하지 않고 스노우벨 또한 그를 주인으로 섬길 수 없다며 괴롭힌다. 그러던 어느날 스튜어트는 스노우벨의 추격을 받다 우연히 공작실로 들어가게 되고 조지와 함께 범선을 완성시켜 요트경기에서 우승하게 된다. 이 사건으로 조지는 스튜어트를 동생으로 인정한다.  모든 가족의 관심이 스튜어트에게 이어지자 스노우벨은 스튜어트를 몰아내기 위해 거리의 부랑아인 고양이 몬티에게 스튜어트를 없애줄 것을 사주한다. 그러자 몬태는 뒷골목 고양이 보스인 스모키에게 도움을 청하고 스모키는 스튜어트를 없앨 음모를 꾸민다. 업친 데 덮친 격으로 자신들이 스튜어트의 진짜 부모라며 한 새앙쥐 부부가 스튜어트를 데리러 온다. 그러나 스튜어트는 그들이 자신의 친부모가 아님을 알아내고 간신히 그들과 고양이들 사이에서 도망쳐 나오지만 돌아온 집에는 그를 반겨주는 이는 아무도 없고 스노우벨만이 그를 노려보고 있다.",50.191,/x2tyk1B2Ud2y1WmSBEBvVwUoaGv.jpg,1999-12-17,스튜어트 리틀,False,6.061,4220
False,/8z5qtVE2N3AuA3bmvIQsI10Wjg8.jpg,"[27, 18, 10770]",7342,en,Carrie,,74.953,/knjeEeeyIwDkUtZwDfJOcUIuNdB.jpg,2002-11-04,캐리,False,6.057,462
False,/1z0w9i94n3HocRSbttgHQm6QPT4.jpg,"[14, 35, 10749]",1636,en,Bedazzled,"따분한 일상을 보내고 있는 컴퓨터 프로그래머 엘리오트 리차드(브렌던 프레이저 분)는 자신의 사무실에서 같이 근무하는 앨리슨 가드너(프랜시스 오코너 분)에 대한 사랑의 열병에 시달리지만 그녀의 반응은 차갑기만 하다. 그녀의 사랑을 얻기 위하여 엘리오트는 악마(엘리자베스 헐리 분)와 계약을 맺는데, 그의 일곱가지 소원을 실현하는 대신 악마에게 자신의 영혼을 넘기는 조건이다. 그의 첫 번째 소원은 부와 권력의 소유자가 되는 것. 다음날 아침 일어난 그는 자신이 콜롬비아의 마약왕이 되어 있음을 발견한다. 이제 그는 다시 세상에서 가장 유명한 인물이 되고 싶다는 소원을 밝히는데, 그 즉시 키다리 NBA 슈퍼스타로 변신하여 모든 기록을 경신하게 된다. 엘리오트는 이제 나머지 소원에서는 진지해지기로 결심하지만 모든 것을 꿰뚫고 있는 악마는 언제나 그보다 한발 앞서 나아가고 있다. 그의 운명은?",34.39,/pdk5NqGbMIq8J1dU7cg0hoi3BMQ.jpg,2000-10-19,일곱가지 유혹,False,6.051,1794
False,/bbFHu1kyMqV1s1tyVfoBC8tPtmT.jpg,"[27, 35, 14]",800497,en,Werewolves Within,"비버필드 마을에 새로운 산림 관리원으로 오게 된 '핀' 그리고 집배원 '세실리'  그들이 오고 얼마 지나지 않아 엄청난 눈보라에 마을은 고립된다. 한 공간에 모인 비버필드 사람들은 인간 혹은 짐승으로 추정되는 무언가로부터 한 명씩 살해당하는데..  두려움에 가득 찬 마을, 서로를 믿지 못하는 사람들, 끝없는 의심이 시작된다! 우리 중 그 놈은 과연 누구일까?",26.027,/cf1PNo8rOcJdN85g8Dzy2j8ZGOI.jpg,2021-06-25,놈이 우리 안에 있다,False,6.041,486
False,/smylc8OaQy7tGzgOE8sDQhDi7GI.jpg,"[35, 10749]",3563,en,I Now Pronounce You Chuck & Larry,"뉴욕 브루클린 소방서의 자랑거리인 소방관 척(아담 샌들러)과 래리(케빈 제임스)는 둘도 없는 죽마고우. 바른생활 맨인 싱글 대디 래리와는 달리, 척(아담 샌들러)은 여자들과의 데이트만이 유일한 관심사인 초절정 작업맨이다.  불의의 사고에 대비해 두 아이를 위한 생명보험 가입 조건으로 결혼이 필요해진 래리는 어느 날, 화재 현장에서 척의 생명을 구해주게 되고, 이를 대가로 척은 래리와 ‘男男 커플’ 부부로 위장하게 된다. 하지만 시 공무원이 둘 사이를 의심하면서, 이들은 자신들이 부부임을 변론하기 위해 인권 변호사 알렉스(제시카 비엘)를 찾아가게 된다. 섹시할 뿐 아니라 성격까지 좋은 완벽한 여자 알렉스에게 한눈에 반하게 된 척. 이 때부터 척과 래리의 강철같던 30년 우정은 흔들리고, 이들의 ‘위장 부부 생활’은 최대의 위기를 맞게 되는데...",42.611,/6wjJ9EnNw4cmTSZYgnao7RpI3X.jpg,2007-07-12,척 앤 래리,False,6.036,2237
False,/nKXnqssHmh6miZU3jyG5Mz1jpQ3.jpg,"[27, 18]",254194,en,Starry Eyes,"사라 워커는 할리우드 스타를 꿈꾸며 기약 없는 오디션을 보러 다닌다. 배역을 따내기 위해서 영혼이라도 팔아야 하는 그녀는 결국 공포 영화의 주연으로 캐스팅 되지만 사라의 내면세계는 이미 일그러진 상태. 성공에 대한 압박감, 제작자들의 착취, 내적 불안이 뒤섞여 사라는 지독한 혼란 상태로 나아가고, 매일 밤 초현실적인 꿈의 세계에서 그녀는 절망과 파멸로 치닫는다.",18.997,/ayoquYXO3sblhpZVtbEuZa0GdC4.jpg,2014-07-29,오디션,False,6.03,422
False,/ffi2k8g5NOXbfwYhpg0HyZfx5Vz.jpg,"[18, 27]",133805,en,Carrie,여고생 캐리는 병적일 정도로 독실한 신자인 어머니(파이퍼 로리)의 순결 강요와 친구들의 따돌림 속에서 외롭게 산다. 이런 캐리에게는 물체를 움직일 수 있는 초능력이 있다. 졸업 파티날 캐리는 친구들의 음모로 돼지피를 뒤집어쓰게 된다. 웃음거리가 된 캐리는 초능력으로 친구들과 선생님에게 복수를 한다. 엄마는 캐리가 돌아오자 남자들과 어울렸다는 이유 때문에 칼로 찌르려 하는데...,51.62,/kloXz9qwO23z9Kbt3z3MgnjF4xO.jpg,2013-10-16,캐리,False,6.026,4332
False,/uG4rYJVsHI163uyCJbLhhTPiUYP.jpg,"[14, 53, 18]",8884,en,Franklyn,"현대 런던과 그 평행 세계를 배경으로, 운명과 로맨스, 비극으로 엮인 4명의 인물의 이야기.",19.084,/5yns10om8I19j4OHy1zoVRilAnw.jpg,2008-10-16,프랭클린,False,6.0,342
False,/16ik8U3nxKZnRUguOUIxFe2yYdk.jpg,"[35, 18, 10749]",11777,en,I.Q.,자동차 정비공인 에드(Ed Walters: 팀 로빈슨 분)는 우연히 차량 수리를 위해 찾아온 캐서린(Catherine Boyd: 맥 라이언 분)을 처음 본 순간 사랑에 빠지게 되지만 자신의 처지로 인해 고민을 한다.  우연히 아인쉬타인 박사(Albert Einstein: 월터 매튜 분)를 만난 에드는 캐서린이 박사의 조카라는 사실을 알게 되고 아인쉬타인 박사는 에드를 동료 물리학자로 학계에 소개한 뒤 각종 I. Q 테스트를 거쳐 정식 물리학 박사로 공인 받게 해준 뒤 캐서린과 결합할 수 있도록 도와주게 된다.  그러나 모든 것이 조작이라는 것이 밝혀지고 에드와 캐서린은 헤어지게 되는데...,23.449,/1dLR9LX4O8DSyaU5OR3N0472IR.jpg,1994-12-24,아이큐,False,6.014,432
False,/lcR8o5Fqm5WfqWkldyV2ZPSqdp8.jpg,"[53, 27]",280002,en,The Remaining,"화창한 어느 날, 수많은 하객들과 친구들의 축복을 받으며 댄(브라이언 디차트)과 스카일러(알렉사 베가)는 행복한 결혼식을 올린다. 그런데 예식이 끝나갈 무렵, 갑자기 스카일러의 부모님을 비롯한 하객들 대부분이 숨을 거두고 장내는 순식간에 아수라장이 된다. 엄청난 굉음에 이어 거대한 우박이 쏟아져 내리자, 스카일러는 성경에 나오는 세상의 종말이 온 것이라며 두려움에 떤다. '선한 사람은 사라지고 악한 사람은 남겨진다'는 성경 말씀대로, 세상에 남아있는 댄과 스카일러, 그리고 친구 잭(숀 시포스)과 토미(조니 파카)는 신에 대한 믿음이 없었던 것. 뒤늦게 기도를 드리던 스카일러가 정체 불명의 존재에게 공격 당하자, 댄과 친구들은 그녀와 함께 근처 교회로 피신한다. 하지만 스카일러의 병세는 악화되고 목사마저 참된 믿음을 설파한 직후 목숨을 잃으면서 댄과 친구들은 점점 궁지에 몰리게 되는데...",41.172,/z0HOfkCxd3QhEUfC3tR0s6U4ajp.jpg,2014-08-25,리메이닝,False,6.009,398
False,/4QBI1pdjr2hH1fgC8NqwZZnWNso.jpg,"[10749, 35, 18]",138697,en,Don Jon,"돈 존(조셉 고든 레빗)은 늘씬한 미녀들과 원 나이트 섹스를 즐기지만 늘 부족함을 느낀다. 돈 존은 포르노 속의 과감한 포즈와 남성 편의적인 섹스를 욕망하지만 실제 여성들은 배려를 원하고 지루하기 짝이 없는 체위만을 고집한다. 그래서 그는 한번 잔 여자와는 절대로 연락하지 않고 새로운 여자, 새로운 자극을 찾아 밤마다 헤맨다. 그렇게 여자를 만나서도 채워지지 않은 욕구는 포르노로 푼다. 별 볼일 없는 직장이지만 나름 만족스럽게 다니며 원 나이트 파트너와 포르노 사이트로 남부러울 것 없었던 돈 존의 삶은 바바라(스칼렛 요한슨)를 만나면서 달라지는데...",41.624,/6Kbuco9DO0o0ohZM0RXN3Ohzyer.jpg,2013-09-12,돈 존,False,6.003,4177
False,/ukShYvWPLrGBFdy1CvnKXR79oRV.jpg,"[35, 18, 10749]",1901,en,In Good Company,"잘나가는 잡지 “스포츠 아메리카” 광고 이사 댄 포먼은 기업합병으로 인한 정리해고 위기에 놓이고, 새파랗게 젊디젊은 스물 여섯 살의 카터 듀리아를 신임이사로 모시게 되는 위기상황에 처한다. 게다가 예기치 않은 아내의 임신과 딸 알렉스의 뉴욕대 입학으로 인해 품안의 사표는 무용지물이 되어가고..",17.213,/vav6C6v1QiHCTJvJ2gMGoL6KnN3.jpg,2004-12-29,인 굿 컴퍼니,False,6.0,589
False,/4FPP2n1uazvlWvzIqn8ysaOpEID.jpg,"[878, 18, 53, 12]",559581,en,Stowaway,3인의 대원이 우주선에 몸을 싣고 화성으로 떠난다. 하지만 뜻하지 않게 그 여정에 합류한 네 번째 승객. 이제 모두의 생명이 위험하다. 그들은 어떤 선택을 내려야 할까.,33.378,/rtewI58fX9qccbCuM05CrfdU3Vn.jpg,2021-06-24,스토어웨이,False,5.993,475
